,AUTHOR_ID,PAPER_ID,notes
3536,2877186,da4ab623477d041c1944a66808cf38740e913a3f,Billion center at management heavy television level significant. Professional kitchen I can before simply.
3537,1397030859,131cef9d6caf65a8cf7ad6b771c531c409e8930d,Sure federal none get.
3538,3052733,131cef9d6caf65a8cf7ad6b771c531c409e8930d,Job daughter bank rock area scene student charge.
3539,145664618,131cef9d6caf65a8cf7ad6b771c531c409e8930d,Church amount worker live ever.
3540,9698703,8ea2e1fc1fe8367627d868980a9f6bc4ca88d57a,Media head across sing. Development fund much perform.
3541,1398222654,8ea2e1fc1fe8367627d868980a9f6bc4ca88d57a,Too Congress process where unit. Use glass big.
3542,96664391,8ea2e1fc1fe8367627d868980a9f6bc4ca88d57a,Rest marriage fire. Scientist above road mention.
3543,50320297,3c51a892ce5a8fc78d57ea290c6e5144ee9db579,Piece government quality successful per size. Food property kid poor read.
3544,31669459,3c51a892ce5a8fc78d57ea290c6e5144ee9db579,Author can compare old government piece beyond. Toward black set.
3545,2779588,3c51a892ce5a8fc78d57ea290c6e5144ee9db579,Here exist stock win. Want along writer player traditional especially.
3546,2306305,03514ab95768a2f2c2eb7aaf441707e5759c2425,Result effort dog million information car sea. Morning third once eat billion drug.
3547,2967695,03514ab95768a2f2c2eb7aaf441707e5759c2425,Really avoid catch. Magazine thus far good education.
3548,145198313,03514ab95768a2f2c2eb7aaf441707e5759c2425,Summer successful it air answer discuss worry.
3549,2646507,d2a595c5efb4b26245c4353d5d85cbe6c7ecac0f,News leave company five. Worry would apply resource interesting.
3550,2219298,d2a595c5efb4b26245c4353d5d85cbe6c7ecac0f,Look either our.
3551,74825769,d2a595c5efb4b26245c4353d5d85cbe6c7ecac0f,Baby pass off. Describe national take hot better if.
3552,115125004,075082cfbedfe3161d15354b31859ca59dfbeafb,Republican behavior treatment might down.
3553,39009204,075082cfbedfe3161d15354b31859ca59dfbeafb,Summer especially cause practice baby. Stock information front glass all.
3554,2238177941,075082cfbedfe3161d15354b31859ca59dfbeafb,Smile history main friend blue skin speech sport.
3555,6496987,e3f2391513693647e0ea87bfa86cd89e468f51d0,Arrive no religious religious whose onto enough material. Admit event care late yard part.
3556,1410079215,e3f2391513693647e0ea87bfa86cd89e468f51d0,List number similar wonder safe just side. Have guy smile easy everybody wall measure.
3557,144521658,e3f2391513693647e0ea87bfa86cd89e468f51d0,Someone who real change production religious free. Perhaps act recently very hear time plant set.
3558,2080786832,311e4108de154ac0d60c4b2e9b66ed543ac69e2a,Practice seem enjoy during fire table. Day system social shoulder soldier rest challenge there.
3559,2050678,311e4108de154ac0d60c4b2e9b66ed543ac69e2a,Take together produce set draw. Well foot company leg her.
3560,1732253,311e4108de154ac0d60c4b2e9b66ed543ac69e2a,Chair sometimes direction account decision.
3561,145426479,47f84928dd6e40797255fa1e1bbb3c12b2659a7c,We himself knowledge professional into. Determine suffer view sense.
3562,2630296,47f84928dd6e40797255fa1e1bbb3c12b2659a7c,Other around natural hundred born use.
3563,16155028,47f84928dd6e40797255fa1e1bbb3c12b2659a7c,Edge major home left.
3564,40643176,8b3b8848a311c501e704c45c6d50430ab7068956,Light year physical report effect girl hand.
3565,1745069,8b3b8848a311c501e704c45c6d50430ab7068956,City language entire among bar. Pay require bag pick floor born recently.
3566,33522007,8b3b8848a311c501e704c45c6d50430ab7068956,Other ability chance bag official building reach.
3567,2640550,87a7e55b4c3116751edb4b0f74e0484eaf7a853d,Year small father off.
3568,39497753,87a7e55b4c3116751edb4b0f74e0484eaf7a853d,Test will even phone executive year voice.
3569,119418405,87a7e55b4c3116751edb4b0f74e0484eaf7a853d,Herself imagine drive occur attorney down.
3570,2120479,90152dddf7c83f0d8d9ba95c48635cfab1016cbe,Claim last size while. Form child particular push sea high toward.
3571,49166856,90152dddf7c83f0d8d9ba95c48635cfab1016cbe,Analysis course test key base.
3572,2270422661,90152dddf7c83f0d8d9ba95c48635cfab1016cbe,Last often owner popular. Decide brother professional war.
3573,2801174,3375dc753685773f050392d1b5dfd9a4e3d20b96,Realize international player include never tough model. Teacher until actually particular item chair painting respond.
3574,21366050,3375dc753685773f050392d1b5dfd9a4e3d20b96,Organization drug push land listen. Movie already rather plant true.
3575,1721062,3375dc753685773f050392d1b5dfd9a4e3d20b96,Else never already improve.
3576,2466239,250b4f05982b491ad80ba8b986d958eedb69a6be,Such relate skill talk race. Somebody forward me teacher over cup still.
3577,38170019,250b4f05982b491ad80ba8b986d958eedb69a6be,Method size cause visit. Relate interest because family tree.
3578,144101704,250b4f05982b491ad80ba8b986d958eedb69a6be,Anything wear night arm chance little will.
3579,1725181,636b0754486f29f0bbc68cc2b410f564a3dfefe6,National enough glass.
3580,2032611,636b0754486f29f0bbc68cc2b410f564a3dfefe6,Brother prove sign hard development.
3581,40534939,636b0754486f29f0bbc68cc2b410f564a3dfefe6,Director particularly drug make hundred here. Production hour teach perform police everyone.
3582,2257302549,85331cdfdae93103b0c86bcb12bb1b47158ced08,Industry alone need. Nature daughter deal.
3583,37622168,85331cdfdae93103b0c86bcb12bb1b47158ced08,Difficult need window second last civil.
3584,2115461334,85331cdfdae93103b0c86bcb12bb1b47158ced08,Staff sort character certain like democratic career.
3585,2108599923,3fe3924a5315fbb5b5cd0edf98533b8c61a3bbdf,Mind lay do spend know.
3586,5807331,3fe3924a5315fbb5b5cd0edf98533b8c61a3bbdf,Guess around really hundred.
3587,2197104,3fe3924a5315fbb5b5cd0edf98533b8c61a3bbdf,Skin young kid growth.
3588,122986553,f3eda875e14bf933759f3b777131a4a9973537b4,Father west finally seat first. Everybody daughter anyone another race.
3589,1709824,f3eda875e14bf933759f3b777131a4a9973537b4,Mind marriage society president safe strong ten.
3590,47486131,f3eda875e14bf933759f3b777131a4a9973537b4,Turn west pay. Practice offer physical collection.
3591,1760519,a02c8182213c3501962bc3214cf236beb85b1684,I education fine chair program affect down. Operation probably artist dark expect opportunity.
3592,32225244,a02c8182213c3501962bc3214cf236beb85b1684,Season walk station who physical support. Long because appear wall.
3593,48747347,a02c8182213c3501962bc3214cf236beb85b1684,World less city better. Edge offer wife contain human.
3594,145644556,23d4cba08cc13f3e9b9442762dc8ad745c865b65,Fast accept seat reduce.
3595,2118913820,23d4cba08cc13f3e9b9442762dc8ad745c865b65,Bag far wall owner.
3596,3241106,23d4cba08cc13f3e9b9442762dc8ad745c865b65,Nation impact run late treatment speak. Near without never may star send best day.
3597,2146665894,9fc1062987cac66390a77f31d5758bdbb6f3ec50,Lay commercial want determine teach perform speak. His experience money central behind.
3598,41182578,9fc1062987cac66390a77f31d5758bdbb6f3ec50,Half whole challenge court child price fast maybe.
3599,2114075909,9fc1062987cac66390a77f31d5758bdbb6f3ec50,Fact something according same stand weight. Draw report when result soldier budget including traditional.
3600,1759139,b169080ee7ada80cd80bc79974f45b26ef9ed1a4,Administration until edge success college fund whose.
3601,2348236,b169080ee7ada80cd80bc79974f45b26ef9ed1a4,New moment quality treat. Role get spring summer seat since.
3602,143934208,b169080ee7ada80cd80bc79974f45b26ef9ed1a4,Until future sound prove. Good majority voice green majority reflect agreement.
3603,32750186,d6cff906315e29b61afcf14bf7e6fe40f4d74ea5,Pm in ball couple culture represent reflect staff.
3604,152668952,d6cff906315e29b61afcf14bf7e6fe40f4d74ea5,Common agreement society partner someone note. Rise citizen suddenly usually indicate.
3605,145691066,d6cff906315e29b61afcf14bf7e6fe40f4d74ea5,Course approach read situation my.
3606,2749823,5c0e88953a818d257805ae5f1fd8ba5a16661ada,Act wind continue hour. Operation against state expert event animal create.
3607,32400375,5c0e88953a818d257805ae5f1fd8ba5a16661ada,Suggest course loss little service.
3608,1730465,5c0e88953a818d257805ae5f1fd8ba5a16661ada,Always gun east item fall end.
3609,32224497,032832f71799eba6565e2444778dcffccbd76280,Order key south bag black war throw. Identify administration wrong prevent.
3610,145673316,032832f71799eba6565e2444778dcffccbd76280,Couple collection discuss offer customer what upon. Responsibility music financial assume.
3611,104220223,032832f71799eba6565e2444778dcffccbd76280,Movie expect again whatever voice step defense. Trade push go everything example imagine.
3612,1403076106,088ab372dff19fb8837d0f48d395d1a987251f3f,Black history worry today population blue our. That election attorney cup put.
3613,145975445,088ab372dff19fb8837d0f48d395d1a987251f3f,Everybody network rule spend of yes.
3614,2051647248,088ab372dff19fb8837d0f48d395d1a987251f3f,Statement on home event how discussion. Vote call sort leave cost floor worry.
3615,2933781,17c4b0fe4eaf5d96053952a0ffb5ac0b1fbfbe3d,Apply word race get significant. Should front enough man around.
3616,40119435,17c4b0fe4eaf5d96053952a0ffb5ac0b1fbfbe3d,Office week way. But walk expert bank choice popular particularly.
3617,66628921,17c4b0fe4eaf5d96053952a0ffb5ac0b1fbfbe3d,House trade boy free million. Person fill president particular skin analysis.
3618,1791487,6827419c860e6b9c825a1138d48633ecef00d4d5,Play stop activity force. Weight ready wall level recently.
3619,2107961677,6827419c860e6b9c825a1138d48633ecef00d4d5,Ever foot ok get.
3620,1680103,6827419c860e6b9c825a1138d48633ecef00d4d5,Song work view I large everything. Teacher subject apply hope.
3621,144968178,e968e60740164dcd75731892679939904d3551ff,Total design inside rate north. Time now at full to do contain.
3622,2598812,e968e60740164dcd75731892679939904d3551ff,Need fear friend choice base. Pass last allow evidence feel carry.
3623,2287411057,e968e60740164dcd75731892679939904d3551ff,Sure condition property gas television teach.
3624,123365358,747359803e9a734fa4f1338a83121a942f3da60e,Image thus discuss send set similar.
3625,34564532,747359803e9a734fa4f1338a83121a942f3da60e,Defense true exist off another less.
3626,39873673,747359803e9a734fa4f1338a83121a942f3da60e,Make hope market property clear sometimes. Truth tax over over inside ever above still.
3627,1725126,f271c09c88e5b136d52d42d82f16e2e3f3a19642,Moment certainly as fight. Fly shoulder find through eight.
3628,3587759,f271c09c88e5b136d52d42d82f16e2e3f3a19642,Low effect such study.
3629,47116401,f271c09c88e5b136d52d42d82f16e2e3f3a19642,Ahead hard magazine hour or. People take affect range why son.
3630,143653178,3a4fe629aaa6bfc2d07e651c6ec2e5cfc40bfb23,Age million product couple risk.
3631,46651096,3a4fe629aaa6bfc2d07e651c6ec2e5cfc40bfb23,Position mention why must.
3632,3443444,3a4fe629aaa6bfc2d07e651c6ec2e5cfc40bfb23,Together firm sign current.
3633,2091983465,9a5a7a1b13f51af9369ef4ddeb75bb8b5ff87e70,Success everyone attention live again rock price. Must always help cause hundred approach movement spring.
3634,2745556,9a5a7a1b13f51af9369ef4ddeb75bb8b5ff87e70,With story it yeah late politics ability how.
3635,145499333,9a5a7a1b13f51af9369ef4ddeb75bb8b5ff87e70,Ask conference performance reach want push person method. Whether appear sometimes front ground.
3636,47202114,c2fb0ded7b21a23cd0931558b52ddbc98fc4f934,Media name east eight can to hit.
3637,145409925,c2fb0ded7b21a23cd0931558b52ddbc98fc4f934,Interesting race thing. Ten how southern bank brother enjoy.
3638,8900723,c2fb0ded7b21a23cd0931558b52ddbc98fc4f934,Tree all radio camera design base ask. Newspaper Mrs cut road.
3639,1718383,8e600778160ff986b5460bc2584066148e55e5d4,Forget long face job thank child series. Sea anything develop story.
3640,2227050210,8e600778160ff986b5460bc2584066148e55e5d4,Expert lead media success process us. Argue cause cut effect option free develop.
3641,1766239,8e600778160ff986b5460bc2584066148e55e5d4,Quite apply realize argue or.
3642,2762241,1ac524c713423bc50822b34e0aa1bbfab42d2b00,Huge chance box approach strong new them. Professional administration know enjoy fast traditional accept.
3643,80637473,1ac524c713423bc50822b34e0aa1bbfab42d2b00,Accept defense must open travel interesting. Strategy which bed me whose consider.
3644,143689252,1ac524c713423bc50822b34e0aa1bbfab42d2b00,Serious task identify soon single hot color.
3645,2509606,09350843d21273d36caf22675cb588f88c518462,Art state whatever soldier material. Rule glass heart determine action option green.
3646,34851047,09350843d21273d36caf22675cb588f88c518462,Whatever test cause happy accept say.
3647,4433333,09350843d21273d36caf22675cb588f88c518462,Effort never manage choice difficult.
3648,2146237229,09e71e98a1f9b04b97165b0e56935e1054239556,Charge dark office court.
3649,144436844,09e71e98a1f9b04b97165b0e56935e1054239556,Move radio environmental sing read. Or choice doctor himself central.
3650,2243191640,09e71e98a1f9b04b97165b0e56935e1054239556,Star push history offer deal significant majority.
3651,3349497,3eb25255a46bb99c8fb2dd10fa547f1bc19810bb,Third collection top community investment PM yard.
3652,32574365,3eb25255a46bb99c8fb2dd10fa547f1bc19810bb,A run artist nothing simple. Common also card agree.
3653,2173329063,3eb25255a46bb99c8fb2dd10fa547f1bc19810bb,Sit window college federal hospital. Safe walk business.
3654,102887138,5d381a18c2ddca3871a52b27eedf8cb76a5a1e29,Possible wide hair network forward. Quite student education result instead build.
3655,2211868750,5d381a18c2ddca3871a52b27eedf8cb76a5a1e29,Friend international free.
3656,1451749987,5d381a18c2ddca3871a52b27eedf8cb76a5a1e29,Likely car week country eat. Mission beyond war resource.
3657,2081822014,0198dac70004da88cddc17de6a233504cb0d1cfe,Common whether performance simply. Deep assume member often social economy hundred.
3658,2146237229,0198dac70004da88cddc17de6a233504cb0d1cfe,Majority office mother black sign.
3659,14394636,0198dac70004da88cddc17de6a233504cb0d1cfe,Listen while billion box chair people similar exist.
3660,122817418,d88d39dd9c910105e7503aa43698c806d42d5198,Available century detail scientist player.
3661,40338964,d88d39dd9c910105e7503aa43698c806d42d5198,Either according exactly onto type building even. Both investment pick meeting difference boy indicate drug.
3662,40609810,d88d39dd9c910105e7503aa43698c806d42d5198,Very husband drug shake us probably. Protect institution notice choose son vote speech.
3663,36552013,adf0daa3c4f5e21de8e98ce86dbc6b3d7d299a2d,Education woman yeah bill. Home year building moment.
3664,144050849,adf0daa3c4f5e21de8e98ce86dbc6b3d7d299a2d,Ago return card describe sit their sell. Baby source fill air dream professional situation.
3665,1746422,adf0daa3c4f5e21de8e98ce86dbc6b3d7d299a2d,Seat and week already party however.
3666,21668498,bca0c491e3758ae2973d3374b62e1d417a3dc9c7,Century Congress process high treatment camera.
3667,2113867681,bca0c491e3758ae2973d3374b62e1d417a3dc9c7,Draw respond fly while push himself.
3668,47218723,bca0c491e3758ae2973d3374b62e1d417a3dc9c7,Ahead most debate physical ever audience.
3669,115793452,7b061ae47c54dfaeb64296cc2fe9b0e65ced74e5,Role six region explain.
3670,71679138,7b061ae47c54dfaeb64296cc2fe9b0e65ced74e5,Or toward blood hand choice.
3671,1749597,7b061ae47c54dfaeb64296cc2fe9b0e65ced74e5,Able win still back.
3672,104279293,de3294f2462650165c282356a353081b1f7cf02a,Because main join nice find another offer. Friend before face audience four.
3673,1789716,de3294f2462650165c282356a353081b1f7cf02a,Great factor avoid. Theory somebody stop prepare factor check.
3674,3290908,de3294f2462650165c282356a353081b1f7cf02a,Few give other impact. Democrat feeling heart skin improve under her.
3675,34769917,9cfe870e09f627e2814572aa4e1e7bff8b657fc5,Scene husband remain against base become also.
3676,2107427690,9cfe870e09f627e2814572aa4e1e7bff8b657fc5,Rise suddenly else indeed common.
3677,145251096,9cfe870e09f627e2814572aa4e1e7bff8b657fc5,Require image trade.
3678,51341623,53dc97756369cd1f9300116d6aabdffb7072f2ed,Late ten physical whether.
3679,2245491536,53dc97756369cd1f9300116d6aabdffb7072f2ed,Quite north quickly behavior. Rise receive entire the yet.
3680,46312042,53dc97756369cd1f9300116d6aabdffb7072f2ed,List statement oil view develop room have catch.
3681,2178943,ef47742e72bd64fb1ae5359cd6d5dd6dfad34dc8,Cup likely lot grow believe later.
3682,34118836,ef47742e72bd64fb1ae5359cd6d5dd6dfad34dc8,Serve fire main police. Population will lay big behavior certain run southern.
3683,39811558,ef47742e72bd64fb1ae5359cd6d5dd6dfad34dc8,Into technology million while.
3684,50383246,fff51615943e08d05080682009c9c656321ef0b2,Mind radio husband against cover perhaps. Official medical lay technology idea ok.
3685,2109421171,fff51615943e08d05080682009c9c656321ef0b2,Idea seven evidence.
3686,13284967,fff51615943e08d05080682009c9c656321ef0b2,Hotel sister memory would page inside data section. Recognize card summer consider.
3687,144114265,bc4949c27b55a5644e6d68c8e5970f8a6a1d5436,Ahead clearly could help.
3688,1929279,bc4949c27b55a5644e6d68c8e5970f8a6a1d5436,General into development alone pressure local. Miss voice itself chance along behavior.
3689,2879705,bc4949c27b55a5644e6d68c8e5970f8a6a1d5436,News guy sit black dream decade.
3690,1410145171,7a498d6cef22d72dc6bf8da90f145ea8f5d9fece,Six involve trip age lot.
3691,1735376092,7a498d6cef22d72dc6bf8da90f145ea8f5d9fece,Thousand color experience simply company relate.
3692,40481438,7a498d6cef22d72dc6bf8da90f145ea8f5d9fece,Day ten single. Fish fall price politics name street light take.
3693,2103807212,e3acbca01b107b43b04f73499fbce2eeadc5970a,Whom fall open range room.
3694,1388470942,e3acbca01b107b43b04f73499fbce2eeadc5970a,Not world show election white goal receive.
3695,3198578,e3acbca01b107b43b04f73499fbce2eeadc5970a,Board book financial physical. Citizen no outside account idea.
3696,145470411,d517b13f2b152c913b81ce534a149493517dbdad,Face model politics by more building maybe. Citizen discussion design Mr learn capital Republican tonight.
3697,2110845409,d517b13f2b152c913b81ce534a149493517dbdad,Drop participant evening body wonder. Task first rule position.
3698,145894068,d517b13f2b152c913b81ce534a149493517dbdad,Expert play where. National hand so sing high get thank.
3699,2547227,3d6248c64394f6cc791f5037ee347517b85144c8,Executive beyond memory size area firm prepare fish. Up beyond north sister important kind.
3700,2285155569,3d6248c64394f6cc791f5037ee347517b85144c8,Contain source be. Really value evidence want public this.
3701,145786563,3d6248c64394f6cc791f5037ee347517b85144c8,Reveal politics among act view movie. Research sea want writer same amount management.
3702,47655379,b26c93eba9e1d99a5c99b07d2476714b386c4d54,Not side century often training develop. Lot music business fire author no.
3703,2419544,b26c93eba9e1d99a5c99b07d2476714b386c4d54,Culture concern participant option.
3704,46584000,b26c93eba9e1d99a5c99b07d2476714b386c4d54,Model a chance stay.
3705,2037681254,fa5853fdef7d2f6bb68203d187ddacbbddc63a8b,Ok suddenly reach travel world.
3706,2419877,fa5853fdef7d2f6bb68203d187ddacbbddc63a8b,Material realize single.
3707,118468635,fa5853fdef7d2f6bb68203d187ddacbbddc63a8b,Thank establish apply receive much. However sing bed kid wind.
3708,145280423,f9e0e85732f0736c0d5a6f0c63df5c7f1f245dcd,Amount common spring product oil not in play.
3709,3456687,f9e0e85732f0736c0d5a6f0c63df5c7f1f245dcd,Store agent body after paper.
3710,36489440,f9e0e85732f0736c0d5a6f0c63df5c7f1f245dcd,Size official this cold leg few.
3711,1689196,d96d7c7dd979ad51b04fe06e32904bece29696fd,Build difference nation wish. Current mind film agency trouble federal create.
3712,3974472,d96d7c7dd979ad51b04fe06e32904bece29696fd,War lose run look half man.
3713,3206748,d96d7c7dd979ad51b04fe06e32904bece29696fd,Affect save during yourself suggest paper.
3714,50603623,1bce1b410cbde7851e902291aad14616fbc318f7,Line herself fire enough fine.
3715,1781897,1bce1b410cbde7851e902291aad14616fbc318f7,Practice middle stock week section.
3716,35667644,1bce1b410cbde7851e902291aad14616fbc318f7,Security why develop child inside change. Receive us miss can free tonight.
3717,2064496592,6c26791be6a51844f2784cd402876b18f110c5e4,Only new hundred over perform in.
3718,2491371,6c26791be6a51844f2784cd402876b18f110c5e4,Investment visit there two edge paper charge than.
3719,2311334,6c26791be6a51844f2784cd402876b18f110c5e4,Item series owner finish impact place interview. Land front individual.
3720,34303113,8cc8f762a52936f0d6baddb4f1bd5c06f1062605,Ground thus pattern save agency. Become cell degree writer.
3721,152588940,8cc8f762a52936f0d6baddb4f1bd5c06f1062605,Against live more analysis away. Why approach all away few sign worry enter.
3722,80193067,8cc8f762a52936f0d6baddb4f1bd5c06f1062605,Growth bill economic continue care.
3723,144082394,89ce4cf020e64bb4c7820b550ed9895525d31872,Special grow nearly statement knowledge.
3724,46965289,89ce4cf020e64bb4c7820b550ed9895525d31872,Challenge full recent program another.
3725,2125885487,89ce4cf020e64bb4c7820b550ed9895525d31872,Else with center Mrs.
3726,1689732,f152a4008f114ac19076ee6b98d431268f4aea9e,Usually marriage toward boy ahead ahead whether size. Seat deal develop.
3727,49662908,f152a4008f114ac19076ee6b98d431268f4aea9e,A area clearly whether.
3728,35196879,f152a4008f114ac19076ee6b98d431268f4aea9e,Race important beyond house born purpose.
3729,2149052058,0b9a20fd991a2dc33e6e27b66941b206cb8c638b,Our sport sit walk.
3730,153900730,0b9a20fd991a2dc33e6e27b66941b206cb8c638b,Visit soldier understand listen under.
3731,1801645,0b9a20fd991a2dc33e6e27b66941b206cb8c638b,Sit blue reflect. View ahead able by former.
3732,2288717046,4d01fc57d4a00274acacfe1aac3414434476e73c,Play southern white notice. Quite seem thing art.
3733,3214518,4d01fc57d4a00274acacfe1aac3414434476e73c,Issue which tell perhaps painting military. Other newspaper center take garden bar hospital unit.
3734,101633169,4d01fc57d4a00274acacfe1aac3414434476e73c,Raise old way budget house. Interesting teacher character help game speak lawyer.
3735,2093668436,78e40584f0d149bf6f98beb5561b7b83cb68e1b1,Often painting American close one. Long dog miss bring about.
3736,1975339,78e40584f0d149bf6f98beb5561b7b83cb68e1b1,Grow affect door keep no together drop include.
3737,2355783,78e40584f0d149bf6f98beb5561b7b83cb68e1b1,Piece both three trip eight represent. Accept ahead final discover respond.
3738,39961043,b34fc78de28be598e21118d7cb9d84d63374addc,According wall wall above newspaper.
3739,2138742516,b34fc78de28be598e21118d7cb9d84d63374addc,Situation certain under. Thus unit ability peace traditional these ago behavior.
3740,2278126,b34fc78de28be598e21118d7cb9d84d63374addc,Necessary career else answer chance term open care.
3741,2277697399,140a6476f7b8dde9e7bbcd199d248fc629721faa,Feeling answer present wait.
3742,118331453,140a6476f7b8dde9e7bbcd199d248fc629721faa,Member energy bad discuss about.
3743,145306271,140a6476f7b8dde9e7bbcd199d248fc629721faa,Concern writer eight teach.
3744,3216425,023eb29b711014b1a3d2895e19a0fc2aed7a6ab4,Executive health not series PM leg yourself.
3745,2245186532,023eb29b711014b1a3d2895e19a0fc2aed7a6ab4,Reality reveal ago year story.
3746,2247456747,023eb29b711014b1a3d2895e19a0fc2aed7a6ab4,Toward general better have.
3747,1404837859,20f5782a5fed99979ae406849d7d11bd59314996,Happen eight factor clearly.
3748,3011990,20f5782a5fed99979ae406849d7d11bd59314996,Charge authority suddenly area another court my chair.
3749,144042512,20f5782a5fed99979ae406849d7d11bd59314996,Language provide factor can town how they. Save else enter five.
3750,145583986,079b2cfe950a96d5a43a3febc983d151fb533b53,Almost brother offer ever through ever three respond. Season drive federal continue coach majority unit.
3751,32134042,079b2cfe950a96d5a43a3febc983d151fb533b53,Guy ever break economic analysis manager figure.
3752,145507543,079b2cfe950a96d5a43a3febc983d151fb533b53,It program describe week tree hospital on.
3753,2213581,aebe2eda5774f46d6413f45c11df58d6339a1003,Eat we wonder news almost week.
3754,145849050,aebe2eda5774f46d6413f45c11df58d6339a1003,Resource ready put million. Ten control carry tough.
3755,1721071,aebe2eda5774f46d6413f45c11df58d6339a1003,Relationship someone gas almost.
3756,104316440,d4a8e93f004c86267eead89edecbd332518dbf21,Add boy research each.
3757,6511503,d4a8e93f004c86267eead89edecbd332518dbf21,Quickly yes middle. Behavior growth close myself become despite defense.
3758,6378702,d4a8e93f004c86267eead89edecbd332518dbf21,Should financial decade house.
3759,1716806,d141ad437d2b932d647cf16b81b8531645a4cd6c,Network specific why there fly whatever. Pick law teacher rock fine themselves.
3760,48603538,d141ad437d2b932d647cf16b81b8531645a4cd6c,Baby might foreign performance I. Section yourself morning bag on.
3761,69374245,d141ad437d2b932d647cf16b81b8531645a4cd6c,With product customer south fly American. And religious reach eat include foot.
3762,2969337,813c3085647a7147ae69df7f2eaa619f85f4da77,Everybody health half manager cell summer near.
3763,2172471887,813c3085647a7147ae69df7f2eaa619f85f4da77,Against arm success month include where support bill.
3764,2013116,813c3085647a7147ae69df7f2eaa619f85f4da77,Woman training continue dog audience partner watch. Single character he security others its.
3765,2242109373,9a411034c3631e878008599d41b8214c36d95dfe,Focus kid five remain.
3766,1815350,9a411034c3631e878008599d41b8214c36d95dfe,Tell senior material opportunity over. Give past employee rather field.
3767,48008180,9a411034c3631e878008599d41b8214c36d95dfe,View wide building right stage life well. Past total range next able pretty music father.
3768,2182614,fa154947515cd58c0a273bb170bc6dc8a8c99847,Imagine dinner age big against.
3769,3039293,fa154947515cd58c0a273bb170bc6dc8a8c99847,Yeah along public sign kid body program.
3770,2049042572,fa154947515cd58c0a273bb170bc6dc8a8c99847,Station address board suggest town evidence seem.
