,AUTHOR_ID,PAPER_ID,notes
0,3110179,3bee5cc2d0b6bfcd564158cd0cf1bd311dae68b7,World artist leader their last receive. Collection nothing order cost majority.
1,49236095,3bee5cc2d0b6bfcd564158cd0cf1bd311dae68b7,Forget class bag. There true audience parent ago drive name.
2,2087257,3bee5cc2d0b6bfcd564158cd0cf1bd311dae68b7,Help water building material. Machine opportunity thing court chance pattern member.
3,2673957,0e5bccdedb82fbafece8ca71d64b16ff05ec9145,Significant name think water effect. Throw morning your.
4,49527646,0e5bccdedb82fbafece8ca71d64b16ff05ec9145,Better service across read reason sister pay.
5,103021875,0e5bccdedb82fbafece8ca71d64b16ff05ec9145,Seat remain peace analysis.
6,2072057031,c9c73f5a1668b8bf12aae2efb6ac5a5a2c34002a,Be build although seem.
7,114113853,c9c73f5a1668b8bf12aae2efb6ac5a5a2c34002a,May we partner yet site. Best peace myself identify better five society better.
8,46855299,c9c73f5a1668b8bf12aae2efb6ac5a5a2c34002a,Center meeting per level figure until.
9,73572953,e507a66243223b83c50ec8609c8e2db5a99277a7,Despite sound trip interest center evidence. Program future local fine argue ahead page.
10,2167765,e507a66243223b83c50ec8609c8e2db5a99277a7,Lawyer hotel politics. Billion join first floor sing involve society.
11,2781539,e507a66243223b83c50ec8609c8e2db5a99277a7,Group wind eye whether not. Food and vote health thank wish day.
12,2099295,954f2a7b1c6f28c4a845ccda5761eb09da032a64,Factor activity condition particular return half movement nice. Stand very work.
13,39329577,954f2a7b1c6f28c4a845ccda5761eb09da032a64,Smile west reflect Republican author.
14,39468510,954f2a7b1c6f28c4a845ccda5761eb09da032a64,Near course group. Put fund laugh discuss room reduce.
15,1894221,726cb75a8a10b915f463cb45a6dbaf266eabf7b4,Positive nice continue age control.
16,143697908,726cb75a8a10b915f463cb45a6dbaf266eabf7b4,Until federal up point argue religious black. Civil point head school.
17,2142656911,726cb75a8a10b915f463cb45a6dbaf266eabf7b4,Each audience reach step. Difficult official pass face community above control.
18,2007204652,ca5e7580993170b1fe621bc16383ad2dfa6803b5,Beat score create.
19,2247699813,ca5e7580993170b1fe621bc16383ad2dfa6803b5,Your after young word until.
20,30260140,ca5e7580993170b1fe621bc16383ad2dfa6803b5,Author wait key take argue.
21,7737288,70a86a524917db7b6122b6f5e2f45661dca1b8c9,Cold like catch anyone bit then new.
22,2093917079,70a86a524917db7b6122b6f5e2f45661dca1b8c9,Court sign open whether.
23,114167875,70a86a524917db7b6122b6f5e2f45661dca1b8c9,Story after almost above PM administration modern occur.
24,21353595,8d082fcbfb3dd56d52faabe7903f3b0734b1f613,Myself once maybe exactly myself then member. Quality machine authority create.
25,35151586,8d082fcbfb3dd56d52faabe7903f3b0734b1f613,Several receive success smile yeah difference art.
26,4816296,8d082fcbfb3dd56d52faabe7903f3b0734b1f613,They it fall minute.
27,2286232238,06a81f63fc4ccfcf02934647a7c17454b91853b0,Feel position sport woman again create avoid. Hour environment although mission make.
28,2202045321,06a81f63fc4ccfcf02934647a7c17454b91853b0,After son already history. Whatever event girl report key hand.
29,144060663,06a81f63fc4ccfcf02934647a7c17454b91853b0,With outside weight speech care. Onto think yourself step around yet.
30,144527356,a03d8f591bc3c2dbdecbd9d515e0469953a3f7ef,Black employee your foreign. Lot my partner adult news indicate movement road.
31,34432693,a03d8f591bc3c2dbdecbd9d515e0469953a3f7ef,Action work same total drop it particularly. Catch ten from body high trial very section.
32,3369464,a03d8f591bc3c2dbdecbd9d515e0469953a3f7ef,Practice night education successful him. Do manager political north.
33,2068644280,5c86baa92ece7425ceb09232dddd9538c224ce5e,Tree against kind read exactly. Fast too base personal himself nice.
34,48360714,5c86baa92ece7425ceb09232dddd9538c224ce5e,Think best act work newspaper. Over century perform professional.
35,2064952152,5c86baa92ece7425ceb09232dddd9538c224ce5e,Leg assume name. Another career own.
36,3134435,6787a08978444d97d6860359ba24b5a735d492e2,Half process break mouth at control seven. Realize produce quality read contain cup.
37,2267212,6787a08978444d97d6860359ba24b5a735d492e2,Our fall character half military move anything.
38,47487881,6787a08978444d97d6860359ba24b5a735d492e2,Us service show. Determine class phone either writer arrive.
39,2073103619,66470cf9df2f932f80094a309abcc14bcc1b9373,Look prove life design any.
40,3500463,66470cf9df2f932f80094a309abcc14bcc1b9373,Building upon trade example hour production side next.
41,145820668,66470cf9df2f932f80094a309abcc14bcc1b9373,Page care toward over including great understand expect.
42,144890499,25c6565750d7d46c63d9bc073e6826b4d5898498,Audience citizen five receive dream her.
43,39140636,25c6565750d7d46c63d9bc073e6826b4d5898498,Approach development different east already one.
44,1740078,25c6565750d7d46c63d9bc073e6826b4d5898498,Indeed each bill computer defense make. Right cost time who forget network age.
45,152449834,2b9e05c6e282934f69c366f1856b637a921fed5f,Magazine yourself field economy past site. Area truth senior include focus including.
46,72520950,2b9e05c6e282934f69c366f1856b637a921fed5f,International today include girl national capital.
47,82873644,2b9e05c6e282934f69c366f1856b637a921fed5f,None third system. Present field memory American finally east.
48,67180560,5656c718164f6ab8950f13d78ccf5d3b9942df7f,Late before way our authority number. Risk development perform picture common use spring.
49,152507974,5656c718164f6ab8950f13d78ccf5d3b9942df7f,Situation mother sort position I.
50,1722056,5656c718164f6ab8950f13d78ccf5d3b9942df7f,Must line standard couple example.
51,1717349,6a70edfc099614866996222893e91826b4da3677,Sound find strategy inside let individual compare art. Family program employee health goal analysis which.
52,144918359,6a70edfc099614866996222893e91826b4da3677,Talk half work positive across make. Not attorney popular try if human.
53,2261824418,6a70edfc099614866996222893e91826b4da3677,Inside put meeting Republican. He military hotel event population certain home.
54,145900285,cc42c8dac7c3fb8cd522136f1c7c31ae45a3121f,Enjoy difficult war begin radio.
55,4368156,cc42c8dac7c3fb8cd522136f1c7c31ae45a3121f,Tree onto car few.
56,143626110,cc42c8dac7c3fb8cd522136f1c7c31ae45a3121f,Amount sort perform official. That spring news safe whether.
57,2072057031,e7f5ab8f486487dcefdf9b989d0eff2f0beff48c,Administration in billion finally understand bed son.
58,28014924,e7f5ab8f486487dcefdf9b989d0eff2f0beff48c,Three box prepare understand pull road ball American.
59,2286165306,e7f5ab8f486487dcefdf9b989d0eff2f0beff48c,Money study statement Democrat PM maintain. Reduce music later attack not main sister.
60,145715698,137832dd10d669a300b7751e0ed3e3b91172372a,Often sea party rise. Officer player nearly hour concern white.
61,2142983,137832dd10d669a300b7751e0ed3e3b91172372a,Ever build morning affect pretty.
62,1733290,137832dd10d669a300b7751e0ed3e3b91172372a,Bring teach travel wall. Nothing positive nearly order may.
63,47910467,09ee0ba924ffd21fc7e14ad3147284133cf2f576,Industry coach summer million.
64,48011347,09ee0ba924ffd21fc7e14ad3147284133cf2f576,Another need economy world foreign believe.
65,1683380,09ee0ba924ffd21fc7e14ad3147284133cf2f576,Cultural prepare else not magazine. Mrs nothing finally structure movie writer magazine.
66,1381197152,86ee21d690eec2a73806c2086949e944f8b46f7c,Alone best serve big. Free stay fast soldier.
67,48348200,86ee21d690eec2a73806c2086949e944f8b46f7c,Hit system to trouble well.
68,1745715,86ee21d690eec2a73806c2086949e944f8b46f7c,Challenge resource left impact. Hundred power drop standard center those modern blood.
69,143817739,f4c01d8780c86abdcfdd52c60843a2499fd5c1b6,Dinner reality deep general brother expert year bed.
70,145608940,f4c01d8780c86abdcfdd52c60843a2499fd5c1b6,Crime career throw although material foreign maintain. Rate able public writer reason.
71,48379623,f4c01d8780c86abdcfdd52c60843a2499fd5c1b6,Word attorney future sound. Quality inside trial strong speech.
72,34724546,98f84b38956ece37082c7bc2a8282f47454f4427,Listen free challenge help interesting scene what none. Go weight site whatever real bed.
73,2692972,98f84b38956ece37082c7bc2a8282f47454f4427,Land save inside else.
74,144019071,98f84b38956ece37082c7bc2a8282f47454f4427,Thing federal entire style.
75,1811680,0d3e8b3a4bb5ffc8bc0527c443a99eb1438956a0,Bank line first much argue man.
76,4062986,0d3e8b3a4bb5ffc8bc0527c443a99eb1438956a0,Be politics clearly knowledge pay Mrs prevent.
77,2239125357,0d3e8b3a4bb5ffc8bc0527c443a99eb1438956a0,Radio let save relate.
78,134643605,b623b893faa4c6ef54ba87af04a970b8250c5274,Property character idea without song yeah standard.
79,2229077,b623b893faa4c6ef54ba87af04a970b8250c5274,Budget work likely her enjoy design be. Himself become reveal fact manage model especially son.
80,143825690,b623b893faa4c6ef54ba87af04a970b8250c5274,Meeting two better.
81,66628921,4f1e6ec98650287ead42b1f231831234385c5e6b,Arm challenge child responsibility small half.
82,2113506991,4f1e6ec98650287ead42b1f231831234385c5e6b,Fill nature mean race author. Court statement ball environmental support.
83,34879470,4f1e6ec98650287ead42b1f231831234385c5e6b,Like pay sure send.
84,1401702869,ca6ac75d2408d9fbc3ff49e8d62341821574337b,Increase bad contain land main keep look. Research carry ready special price watch gas late.
85,48742163,ca6ac75d2408d9fbc3ff49e8d62341821574337b,Ground staff middle home dog only treat. Particularly behavior good eight thousand account win.
86,120870345,ca6ac75d2408d9fbc3ff49e8d62341821574337b,Soon born life everything several heart. Contain bad response answer magazine hot.
87,40326906,c660f1822cc133f6e48387a36af24747cd2fdeb2,Economy even foreign impact industry thing laugh. Establish company whom know.
88,144303466,c660f1822cc133f6e48387a36af24747cd2fdeb2,Product avoid support fill interview person.
89,1411636298,c660f1822cc133f6e48387a36af24747cd2fdeb2,Big affect after young. Art since rather really modern.
90,144718788,0405150d045bc39ddf5ba8a1c71df8f2d63c661e,Phone research possible produce since plant benefit.
91,48004138,0405150d045bc39ddf5ba8a1c71df8f2d63c661e,Attorney modern out within blood throughout. Scene gun be should.
92,32065651,0405150d045bc39ddf5ba8a1c71df8f2d63c661e,Food anything officer we word but federal. Yet treat sit drug case face simply.
93,1777516,1d984051486471b0ec819113e26fc4440ebff21b,Easy deep surface he thing choice up.
94,1398258700,1d984051486471b0ec819113e26fc4440ebff21b,Chair future campaign believe. Anything great culture guy beautiful theory.
95,2087311,1d984051486471b0ec819113e26fc4440ebff21b,Church pull future.
96,145271554,fdd1ccdea15d3000bcf66a45d64d7a243006b021,Building beyond table after difficult less rich.
97,2738811,fdd1ccdea15d3000bcf66a45d64d7a243006b021,Professor some model everything organization.
98,2060366218,fdd1ccdea15d3000bcf66a45d64d7a243006b021,Ability magazine pick current senior customer himself bit. Church value foreign tough none ball suggest trip.
99,101175559,1d122a074c936fcfd95faf44608e377a9d1799c8,Outside should start visit grow word.
100,35139854,1d122a074c936fcfd95faf44608e377a9d1799c8,Very responsibility cup push information way issue they.
101,2011087,1d122a074c936fcfd95faf44608e377a9d1799c8,Consumer right newspaper activity top.
102,2154883669,68c03788224000794d5491ab459be0b2a2c38677,State seek since part soldier would. Southern add age probably report.
103,1733861,68c03788224000794d5491ab459be0b2a2c38677,Scientist look return.
104,2341667,68c03788224000794d5491ab459be0b2a2c38677,Store follow ever money.
105,145681614,02a9428b5b28d85ea330033fb990dc10cd15cc4e,Idea partner cold ball right.
106,2251267728,02a9428b5b28d85ea330033fb990dc10cd15cc4e,Step wear each could whether between man.
107,145336308,02a9428b5b28d85ea330033fb990dc10cd15cc4e,But organization finally bed soon will. To true information official she to baby.
108,152599370,87752bbb228c597e12cc7e86d9dba4539a04769e,Ever cultural race special style. After culture imagine dinner.
109,145098716,87752bbb228c597e12cc7e86d9dba4539a04769e,East Republican table.
110,1740799,87752bbb228c597e12cc7e86d9dba4539a04769e,Tv like society current. History pattern rest blood.
111,36967624,474de4adfce86e14a59d02ccce59cf158fdc4c36,Number message prove response. Hope western know baby notice.
112,144923779,474de4adfce86e14a59d02ccce59cf158fdc4c36,Site work seem feeling south necessary.
113,40338964,474de4adfce86e14a59d02ccce59cf158fdc4c36,Yes company lawyer determine remember.
114,143636151,b1691f718aedc8e6b31105c50773761c753676f4,Story choice side although material strong. Form shake man foot same including.
115,2081355,b1691f718aedc8e6b31105c50773761c753676f4,Effort assume we.
116,2257092490,b1691f718aedc8e6b31105c50773761c753676f4,Assume growth price success really career evening. Soldier into economic memory city old.
117,2071373,bfd6caddec8a98d531ee9f1f7ebf5833797cd5e3,Receive sometimes thing road always. Series especially budget able physical.
118,88537383,bfd6caddec8a98d531ee9f1f7ebf5833797cd5e3,Something serve hundred model. Every near reflect deal choose clearly.
119,2022944,bfd6caddec8a98d531ee9f1f7ebf5833797cd5e3,Day role until dark. Sport poor where production career old provide.
120,32599628,78597d4989a7f7f892067637dd3271e60569b087,Cup mention century box.
121,2245192165,78597d4989a7f7f892067637dd3271e60569b087,Game appear vote seven grow measure.
122,2226941370,78597d4989a7f7f892067637dd3271e60569b087,Great coach detail from.
123,32009627,6fc1057ccc4d430051b69d456224ce12bca17dcc,Morning system difference moment young face.
124,2272039972,6fc1057ccc4d430051b69d456224ce12bca17dcc,Nature strong peace do event.
125,39714312,6fc1057ccc4d430051b69d456224ce12bca17dcc,Popular international tough.
126,1766239,37c0809e246e593d524fa8a918eaee661124c21f,Crime detail those mother station save. Allow war exist skill before chair.
127,144519234,37c0809e246e593d524fa8a918eaee661124c21f,Finally question season pattern show pay.
128,1852261,37c0809e246e593d524fa8a918eaee661124c21f,All member talk safe tree report. Eye black hospital admit memory.
129,144410786,7fa10285fd3532aea2e64d0d6de06608266b4366,Such do something born thousand relate.
130,2343408,7fa10285fd3532aea2e64d0d6de06608266b4366,Language late put single stop under meet effect. Camera lay body.
131,2288388565,7fa10285fd3532aea2e64d0d6de06608266b4366,Become ball once stock. Quite something eight process learn structure nothing hot.
132,3198578,7463a0b934ac40a353773840485bb56d35fbbb66,Fire group late race. It yard today.
133,2066161367,7463a0b934ac40a353773840485bb56d35fbbb66,Move few piece field season consider amount physical. Public machine responsibility accept rich consumer.
134,2265546725,7463a0b934ac40a353773840485bb56d35fbbb66,Method member draw southern these.
135,7343787,fa87557e2d9a9695a99ec481673fb360fad2a897,Hand study more over fill watch.
136,34823577,fa87557e2d9a9695a99ec481673fb360fad2a897,Popular money safe travel field. Read center from later.
137,2288038863,fa87557e2d9a9695a99ec481673fb360fad2a897,You dream hard once success. Get speech and other you.
138,2055948707,c7f686b1047d6519ea1f90c8e3bfd6e7e2d7aadf,Sense draw thus husband other fight probably. Feel doctor just.
139,50198208,c7f686b1047d6519ea1f90c8e3bfd6e7e2d7aadf,Sometimes service current officer never owner phone.
140,5538503,c7f686b1047d6519ea1f90c8e3bfd6e7e2d7aadf,Impact leg inside six about behind dark baby. Thought garden marriage old whether production this.
141,2469518,4aeda303fa0b9beae3f6d65e052dace9d4540116,Reveal your simple south. Believe on office big record indeed now grow.
142,40040189,4aeda303fa0b9beae3f6d65e052dace9d4540116,Participant control myself stop resource dog. Kitchen trouble already also ago.
143,88127261,4aeda303fa0b9beae3f6d65e052dace9d4540116,Movement fish ground heavy dinner name worry. Party meeting beautiful live movement himself new.
144,2113858148,f86808d344d7884296c222f0cd6892abe411c636,Attack rise role much.
145,6740591,f86808d344d7884296c222f0cd6892abe411c636,Compare find lead staff whom.
146,8126949,f86808d344d7884296c222f0cd6892abe411c636,Table consumer wide may picture.
147,144193437,583c47a08841b662c661973951af40045cec3088,Be over their good impact.
148,97651595,583c47a08841b662c661973951af40045cec3088,International foreign large out. Great police natural care compare assume.
149,1755573,583c47a08841b662c661973951af40045cec3088,Great paper out court contain provide specific.
150,1809915,439ede62248e5f6202982afead02b33d3feffae7,Break be animal air.
151,1390122703,439ede62248e5f6202982afead02b33d3feffae7,Particularly spend until pay long. Low clearly direction still here business.
152,144228103,439ede62248e5f6202982afead02b33d3feffae7,Down others direction budget property difference.
153,2140195354,e39ba4c989874285e9473b4532dc275c12ed78c0,Class data fight lose PM meet skill. Best bar mouth concern.
154,32421869,e39ba4c989874285e9473b4532dc275c12ed78c0,Throw task trip add fall possible and. Nation street pull simply.
155,31420501,e39ba4c989874285e9473b4532dc275c12ed78c0,Camera guess activity fact. Seek benefit reveal this spend according bar.
156,2117168605,6d97dca6deb258c30381956e9af93b12bd5c6d03,Central brother win know employee within technology. Water use determine hot.
157,3890299,6d97dca6deb258c30381956e9af93b12bd5c6d03,Modern very color record. Member like treat whom tax.
158,39496312,6d97dca6deb258c30381956e9af93b12bd5c6d03,Yes page president deal traditional move. Other act say rest world he.
159,2288253968,46da3f3d592ea58211ce6bf8bec05ef0b5e792c2,Tell service cold few yeah fly certain. Both add natural board once music compare.
160,1912050,46da3f3d592ea58211ce6bf8bec05ef0b5e792c2,Protect sure yes role.
161,4301568,46da3f3d592ea58211ce6bf8bec05ef0b5e792c2,Style name above cost run pull this. Glass beat their identify.
162,2222550405,64acb315b6129061c62bfabef2ac06d1a6fff95b,Set memory vote system at.
163,153809986,64acb315b6129061c62bfabef2ac06d1a6fff95b,See go watch front plan. Which public wind after tree born side community.
164,2683457,64acb315b6129061c62bfabef2ac06d1a6fff95b,Information easy bill court. How bank movement father.
165,2971502,3c2d95624ede725cc629cfe63affb57237f009f7,Live particular speech direction statement mouth once. Thus suffer return quickly education participant late.
166,2254612446,3c2d95624ede725cc629cfe63affb57237f009f7,Yeah specific describe pull stuff. Conference question national go.
167,2216707294,3c2d95624ede725cc629cfe63affb57237f009f7,Bag tree buy article if affect able should.
168,4379902,b79ca6fd3df135a9bcf778844be625b764fbcfb3,Listen account sort north group middle time write.
169,2188116,b79ca6fd3df135a9bcf778844be625b764fbcfb3,Energy ask hard game education hotel western.
170,2980450,b79ca6fd3df135a9bcf778844be625b764fbcfb3,Sport population top federal project part view.
171,3337642,107cbf209b1bd25c7bfc75882347a2655da05118,Cultural occur tax including together case. Eight movement nice company outside interest than.
172,3431949,107cbf209b1bd25c7bfc75882347a2655da05118,Thousand save reflect subject wonder all almost particularly. Likely knowledge staff grow speech these purpose.
173,2263256846,107cbf209b1bd25c7bfc75882347a2655da05118,Method book against difficult response.
174,2028001,6fa7236e8ff0d958b77164f72b4ce93df5c61caa,Read office save despite again true.
175,1940692,6fa7236e8ff0d958b77164f72b4ce93df5c61caa,Could street along human within fund.
176,2111089,6fa7236e8ff0d958b77164f72b4ce93df5c61caa,Year left cost develop main. Cold woman no natural together song.
177,2228796,31a8063d5032278580969db08e7ef5589fc58cc6,Popular back center everything green central. Show soldier all just her candidate.
178,2245187556,31a8063d5032278580969db08e7ef5589fc58cc6,Tell series attack fly within.
179,5112255,31a8063d5032278580969db08e7ef5589fc58cc6,Democratic become will notice job modern. Specific opportunity last financial.
180,102394267,4ba01f5f01a3e6cc9f7f08529a49b024148c8843,Would page hair unit may.
181,1381198229,4ba01f5f01a3e6cc9f7f08529a49b024148c8843,Could true open need civil deal then.
182,3874821,4ba01f5f01a3e6cc9f7f08529a49b024148c8843,Federal bit whatever base last whether develop.
183,33751657,843149b649b888fdb3649b8d4852263b62356799,Tell him avoid cost to family issue single.
184,2314246,843149b649b888fdb3649b8d4852263b62356799,Choose high soon give.
185,2285375649,843149b649b888fdb3649b8d4852263b62356799,Boy help firm cup religious. Then between public least technology participant dog.
186,1975196,e71dc6f83f18f654824c00f66361d346aa896049,The past space step defense so energy. Weight agency edge ten drop note left.
187,145460009,e71dc6f83f18f654824c00f66361d346aa896049,Tend article never forward least. Purpose significant town table picture.
188,145104781,e71dc6f83f18f654824c00f66361d346aa896049,Water day stuff imagine born main sound describe. Vote ago sign southern chance.
189,2536413,8b683b12f9efc1d8bdf330182a0afd7c14369ce1,Exist government million response.
190,145439471,8b683b12f9efc1d8bdf330182a0afd7c14369ce1,Language garden something him may main enjoy. Statement office maybe.
191,2287603163,8b683b12f9efc1d8bdf330182a0afd7c14369ce1,Great show lose western expect police process.
192,143863611,287650fad5a478581f0040ad064e6856c7c13af2,Size growth might sister entire guy window. Remember explain player relationship listen.
193,48360714,287650fad5a478581f0040ad064e6856c7c13af2,Value now though clearly whole politics result upon. Resource standard guess back medical much view.
194,2245423619,287650fad5a478581f0040ad064e6856c7c13af2,Public still sit worker nothing.
195,1767678,f6705e68c71bc0b51ddb8d1e4f986c894ba8f34f,Politics Mrs customer window process. Less find huge positive nearly artist.
196,41200687,f6705e68c71bc0b51ddb8d1e4f986c894ba8f34f,Heavy fall contain white use note meet. Huge agency law.
197,3041038,f6705e68c71bc0b51ddb8d1e4f986c894ba8f34f,Since individual matter particular half. Factor speech wonder former local father.
198,2276527096,06ba782753bad19254db5d28ad4155556f286ee0,Boy they southern never rich rock agree head. Trouble need onto choice significant whether.
199,108374560,06ba782753bad19254db5d28ad4155556f286ee0,Billion home baby understand support now help. Pick especially in forward decision line more.
200,144225210,06ba782753bad19254db5d28ad4155556f286ee0,Meeting sure structure clear answer. Wind range require.
201,1799382,917943472ec4a00443d78bb696ed4d8f8d8c7f0a,Young test impact process once peace like.
202,1387911026,917943472ec4a00443d78bb696ed4d8f8d8c7f0a,So drop already product wind book page. Southern recognize seek tonight left lose these economic.
203,145684572,917943472ec4a00443d78bb696ed4d8f8d8c7f0a,Personal exist color collection this.
204,1741662003,cae80eca52369e50037cc761abc0c3d3395881ba,Ahead road building unit meeting relationship.
205,1398633980,cae80eca52369e50037cc761abc0c3d3395881ba,Rich development whose close join sister. Behind grow analysis again.
206,10679138,cae80eca52369e50037cc761abc0c3d3395881ba,Place choice material simply politics method new.
207,2249501485,4b2c57cf9516a1d9eb98877627697c288227d9fb,First all position father.
208,30068646,4b2c57cf9516a1d9eb98877627697c288227d9fb,Truth side program should. Face from carry field break energy senior.
209,144056034,4b2c57cf9516a1d9eb98877627697c288227d9fb,Politics message heart out modern finish system. Chance send bill forward left cut team name.
210,5084447,854b86751d0d02bf205c6fb4bf2f2d13804430ee,Right friend top particularly memory decade.
211,1491611469,854b86751d0d02bf205c6fb4bf2f2d13804430ee,Probably beautiful while several radio animal.
212,1683872,854b86751d0d02bf205c6fb4bf2f2d13804430ee,Spend some give themselves physical manager authority drop. Clearly environment source.
213,143674446,92b68d5a59262971d0f4a563c6abe1be6f2dab56,Include produce as few affect.
214,2142745,92b68d5a59262971d0f4a563c6abe1be6f2dab56,Chair follow man nearly sister.
215,143614435,92b68d5a59262971d0f4a563c6abe1be6f2dab56,Ever class remember thought poor key under though.
216,1727135,ffc8c09a4cb5a174166ac16d19e646bc150c2c31,Democratic something ball next morning.
217,1802804,ffc8c09a4cb5a174166ac16d19e646bc150c2c31,Deal whatever throughout nothing though yes get. Positive college white produce experience opportunity.
218,2138686711,ffc8c09a4cb5a174166ac16d19e646bc150c2c31,Mention half example because. Test someone theory say hot practice writer.
219,2767809,ad950d0d65329910e6251168315db07e1cf7a35f,Member either detail after power. Magazine rise now least seek threat heavy.
220,2150913812,ad950d0d65329910e6251168315db07e1cf7a35f,Raise kid trouble beat if.
221,3223786,ad950d0d65329910e6251168315db07e1cf7a35f,Affect face spring.
222,14293363,d93d4b8a821a6761341fa9ace16b0e3a2ab232c3,Anything expert director. Computer dinner word.
223,1760047,d93d4b8a821a6761341fa9ace16b0e3a2ab232c3,Begin before important health order.
224,47476092,d93d4b8a821a6761341fa9ace16b0e3a2ab232c3,Page enough war person we blood meeting.
225,31914218,58525d47d85d38bc48dbfbcb17020c57a7242ebf,Husband report road.
226,2058870993,58525d47d85d38bc48dbfbcb17020c57a7242ebf,Seat theory see. Wait likely significant reason each hit.
227,1381247907,58525d47d85d38bc48dbfbcb17020c57a7242ebf,Political edge baby it son trip. Try interview free than exist close.
228,48278251,015f6fcfe7fb621dd84fd24ea2beb35321896005,Item vote blue everyone white person. Rest choice during interview.
229,152714397,015f6fcfe7fb621dd84fd24ea2beb35321896005,Final discover left item training.
230,4736631,015f6fcfe7fb621dd84fd24ea2beb35321896005,Billion trial fast section. Culture history maintain.
231,2780009,70eb87613183a9141a8c3ea8212384446e5120a5,Nearly soldier often. Rise phone door age.
232,2288277824,70eb87613183a9141a8c3ea8212384446e5120a5,Fill some conference discussion.
233,2117205678,70eb87613183a9141a8c3ea8212384446e5120a5,Board speech answer establish.
