,AUTHOR_ID,PAPER_ID,notes
5165,2066286,cd247b7830fb58c6f019a79ae9679251176e8342,Paper onto war understand home or. Politics weight community wait appear writer.
5166,1681243,06eb3c3ccae16fced2222f8a45877906f54f2164,Wait west garden agency job industry. Cost century able station keep light stuff write.
5167,103332718,06eb3c3ccae16fced2222f8a45877906f54f2164,Enjoy claim public room measure pull. Traditional police manager international teach black also.
5168,3229613,06eb3c3ccae16fced2222f8a45877906f54f2164,Night open laugh program.
5169,46485606,fc472f5017c6200e79b7540be07bc6b4798b4ef8,In answer season Mrs.
5170,3893189,fc472f5017c6200e79b7540be07bc6b4798b4ef8,Blue let mind job thus people. Traditional community single meeting program significant late.
5171,3241106,fc472f5017c6200e79b7540be07bc6b4798b4ef8,First another soldier. Million on teach manager the well.
5172,6313748,2e75dd6fb569ee917b6571d89afadd980af499c0,Argue single nor item. Of finally put know power be.
5173,2264921278,2e75dd6fb569ee917b6571d89afadd980af499c0,Small movement including wide.
5174,47070198,2e75dd6fb569ee917b6571d89afadd980af499c0,Among else memory participant role government. Action perform serious everyone poor.
5175,1764301,2ff6d7e05b1f74e0b17dbf97a59ac0d75ef65efc,World both next participant.
5176,2065027313,2ff6d7e05b1f74e0b17dbf97a59ac0d75ef65efc,Trip gun clearly response sometimes style care. Majority although under its newspaper policy.
5177,46691607,2ff6d7e05b1f74e0b17dbf97a59ac0d75ef65efc,From get set say. Subject again family long understand.
5178,1388353546,714e6dc60dba65431ecae63310da52462defd9c9,Become black start the wall coach couple.
5179,144790563,714e6dc60dba65431ecae63310da52462defd9c9,Item court reflect full.
5180,2167765,714e6dc60dba65431ecae63310da52462defd9c9,Character travel election site fact program bit.
5181,48858818,2c9b060388b88841cf8095cd9efcbfeb805357f6,Number hospital gas chance really age. Religious road operation identify especially debate.
5182,2108337971,2c9b060388b88841cf8095cd9efcbfeb805357f6,In over some material relationship always.
5183,2156059845,2c9b060388b88841cf8095cd9efcbfeb805357f6,So occur much able chair fine carry. Ever morning tough poor activity century determine.
5184,2120345083,a0cfdfb8cfbe58c3820fb1729c9030cd9a05bc2d,Serve everything deep rather hold.
5185,2116641591,a0cfdfb8cfbe58c3820fb1729c9030cd9a05bc2d,Save structure stand but education finish. Far himself civil life drive but.
5186,2052609304,a0cfdfb8cfbe58c3820fb1729c9030cd9a05bc2d,Hope continue eat group without yet ok.
5187,152476853,b9888bb70d6f246c7ffb53dcb9498bfafe113d8f,Decade thing crime go truth force under. Look themselves major half heart street make.
5188,1705268,b9888bb70d6f246c7ffb53dcb9498bfafe113d8f,Town fly ability beautiful dark customer authority.
5189,81009968,b9888bb70d6f246c7ffb53dcb9498bfafe113d8f,Alone computer theory be. Year thousand which federal price.
5190,1902238,1c3588499908417312d172f1b5102e76a90fbb2c,Watch check stuff owner maybe business stand.
5191,145114523,1c3588499908417312d172f1b5102e76a90fbb2c,Change eat particularly under concern book. Forward teach give next.
5192,35137715,1c3588499908417312d172f1b5102e76a90fbb2c,Line Congress scientist gun former any month.
5193,2328263,0ddc015d3ff0a4247eca90a97cae64970275a19b,Usually section phone drug administration each. Five main lead fast.
5194,1750484,0ddc015d3ff0a4247eca90a97cae64970275a19b,Page later Democrat lot. Rate might much sea drive where.
5195,2778136,0ddc015d3ff0a4247eca90a97cae64970275a19b,Agree like piece week begin avoid natural.
5196,145684572,50819fdfb666fdabb12f00e93e0d7e43ba4ba4bd,Save trip season ever.
5197,46367152,50819fdfb666fdabb12f00e93e0d7e43ba4ba4bd,College outside thus resource. Make lay particular crime sometimes.
5198,32290682,50819fdfb666fdabb12f00e93e0d7e43ba4ba4bd,Lot former alone traditional follow.
5199,34422202,4fcfc3a3263d3d8487e887165ae4200cdac269c5,Boy everybody different seek financial. Benefit can lead edge.
5200,48385754,4fcfc3a3263d3d8487e887165ae4200cdac269c5,Success however serve consumer.
5201,38058438,4fcfc3a3263d3d8487e887165ae4200cdac269c5,Mouth lay pattern entire. Thousand speak seat past support down way.
5202,2270315560,2ea5d8555fe5efb7b35bc40e55ead122cfac03b4,Could position cause back sell.
5203,2063031994,2ea5d8555fe5efb7b35bc40e55ead122cfac03b4,Into organization if realize performance home.
5204,2168899921,2ea5d8555fe5efb7b35bc40e55ead122cfac03b4,Certainly can understand by professor test history bit. Nor keep Democrat TV.
5205,5233078,dc85ca80fb3d75fe63106f631a2f7cd251d2851e,Same message think film card. Cost if land card save almost.
5206,2065615370,dc85ca80fb3d75fe63106f631a2f7cd251d2851e,Over surface cause growth much significant. Among field main worker any.
5207,2254606672,dc85ca80fb3d75fe63106f631a2f7cd251d2851e,Low guess item language want man look.
5208,2114020762,0d7a9a5233b1460941b51a50e032b3c5d3a711cc,Home total adult character gas.
5209,1722393,0d7a9a5233b1460941b51a50e032b3c5d3a711cc,Nature read dog may. Certainly top as option again.
5210,2259641111,0d7a9a5233b1460941b51a50e032b3c5d3a711cc,Country both heavy parent close. Such effort nice animal.
5211,25579571,4f9b916ae1c38b991f39b6ebd6e0a92f88ece698,Seven industry design pay.
5212,1765159,4f9b916ae1c38b991f39b6ebd6e0a92f88ece698,Into money company sign.
5213,1691108,4f9b916ae1c38b991f39b6ebd6e0a92f88ece698,Hope staff me senior student. Suffer friend machine focus agency.
5214,69954095,2d2fe4a73c98933ae9b8df73c8452b0d8be6475e,Particularly analysis price nor.
5215,2066360495,2d2fe4a73c98933ae9b8df73c8452b0d8be6475e,Simply difference four tend on.
5216,143753210,2d2fe4a73c98933ae9b8df73c8452b0d8be6475e,Decide several song edge its improve. Successful simply study free.
5217,143903307,094b19739855efbdacb17a83508c42582391c263,You either special project church finish be.
5218,2866570,094b19739855efbdacb17a83508c42582391c263,Wife detail under try.
5219,1679990969,094b19739855efbdacb17a83508c42582391c263,Cup risk still eight.
5220,35647882,c3d47d49e7c46d2543e92a26b964f42b25371ba4,Occur effect white together.
5221,144813944,c3d47d49e7c46d2543e92a26b964f42b25371ba4,When reflect person way travel one especially. Data speech world meet answer.
5222,29394742,c3d47d49e7c46d2543e92a26b964f42b25371ba4,Science across speak crime usually pressure. Everybody power learn where can there.
5223,1398945328,a78c4df65ee23e4b36207163c5408d61da812f4b,Involve memory health somebody job best try research.
5224,1703046,a78c4df65ee23e4b36207163c5408d61da812f4b,Owner early tax less fish. Hundred could sit over state.
5225,144202084,a78c4df65ee23e4b36207163c5408d61da812f4b,Return speak suddenly keep board economy cold.
5226,1746525,e87f503e838ce7c2ae8a90bfa3cda7bbac8c919a,Office stop model cause central news read.
5227,2231256,e87f503e838ce7c2ae8a90bfa3cda7bbac8c919a,Him theory picture recently according door occur check. Bit guy finally hand serious system.
5228,4724907,e87f503e838ce7c2ae8a90bfa3cda7bbac8c919a,As morning his test threat else action.
5229,153219358,9aa8a679e3401f1bbf805b738095bf2ed52e08e7,Cold condition bag. Safe key discuss production mother.
5230,144338725,9aa8a679e3401f1bbf805b738095bf2ed52e08e7,Kitchen product why home option both.
5231,2051372542,9aa8a679e3401f1bbf805b738095bf2ed52e08e7,I concern myself.
5232,1695044,1a6f4495474f75ae1e8bbf407f70d9a874e5b4d6,Past nature middle very off realize certainly.
5233,2061237038,1a6f4495474f75ae1e8bbf407f70d9a874e5b4d6,Set into pressure expect. Of mother somebody law reveal happen sit.
5234,1390879413,1a6f4495474f75ae1e8bbf407f70d9a874e5b4d6,Account hit wide exist forward avoid boy.
5235,2128298,04eb71ccc65edf1c2b2f3b43bdb89a8e90fe8a8b,Entire floor get finally yard idea now sign. Health door less.
5236,1384189893,04eb71ccc65edf1c2b2f3b43bdb89a8e90fe8a8b,Every according activity which. Involve by street human very process generation.
5237,145026874,04eb71ccc65edf1c2b2f3b43bdb89a8e90fe8a8b,Describe possible make appear week participant.
5238,2055456335,7b815d6c9c0b072278979ba97eda839d141d5d41,Industry south evidence address. Company heavy the.
5239,31717443,7b815d6c9c0b072278979ba97eda839d141d5d41,Arrive politics stuff not. Focus break themselves analysis.
5240,1685102,7b815d6c9c0b072278979ba97eda839d141d5d41,Yet activity need likely improve.
5241,49301018,0b8a18c78e7493fe145382d98fc46f6b427a093f,Phone travel I wall.
5242,3206748,0b8a18c78e7493fe145382d98fc46f6b427a093f,Make former there into. Officer wear quality book music water focus.
5243,2072762,0b8a18c78e7493fe145382d98fc46f6b427a093f,You air we life phone month.
5244,3343280,c45b789b42e9a85d3193f43e3f0ddffb7d6aa423,Study scientist everything. Wind pull member eight system reach include.
5245,3175729,c45b789b42e9a85d3193f43e3f0ddffb7d6aa423,Education decade speak although maybe his several. Our religious bank forget when away.
5246,2257337884,c45b789b42e9a85d3193f43e3f0ddffb7d6aa423,Win at expect admit card wait prove. Never light where human people recent medical easy.
5247,145583986,d594c19d91c55a4e7f341fd1d45fc30c5fac0b1a,Smile reason thank president. Seem example course stock region.
5248,144157548,d594c19d91c55a4e7f341fd1d45fc30c5fac0b1a,View hold special consumer.
5249,5325261,d594c19d91c55a4e7f341fd1d45fc30c5fac0b1a,Company box will produce stay. Result understand product growth when executive.
5250,34831446,c93b938cc6942497a0b683c54a4b606727b2417a,Fact thank process return administration country finish society.
5251,2410217,c93b938cc6942497a0b683c54a4b606727b2417a,Camera remember production pattern. Red begin ten soldier.
5252,2144032040,c93b938cc6942497a0b683c54a4b606727b2417a,Many sort across hear weight course effort key.
5253,145098716,6ff5544640e0ac1e41b98c98a8ef2cd0ba62e9b5,Ball move realize people value effect past support.
5254,1724282,6ff5544640e0ac1e41b98c98a8ef2cd0ba62e9b5,Rock challenge indicate hotel particular. Clearly step man expect term nearly.
5255,5848246,6ff5544640e0ac1e41b98c98a8ef2cd0ba62e9b5,Edge even nearly imagine. Southern worker bank state two.
5256,47180438,a0e5802cf66257d0412de878682dc9caccca0719,Blue draw democratic matter mouth write purpose. Entire whatever window.
5257,2144929813,a0e5802cf66257d0412de878682dc9caccca0719,Door drive news western.
5258,40483582,a0e5802cf66257d0412de878682dc9caccca0719,Best available think night. Improve item participant degree movie less sometimes.
5259,2194791,804836b8ad86ef8042e3dcbd45442a52f031ee03,Throw state add final present.
5260,2058906182,804836b8ad86ef8042e3dcbd45442a52f031ee03,Suggest mind side can small establish task. Rest education must or most.
5261,1388945545,804836b8ad86ef8042e3dcbd45442a52f031ee03,Toward thing that to less. Floor movie mouth finally establish writer.
5262,2150913498,2de0a40e9a5d4f1feb07d61af5a5d87a069653f0,Heavy deal vote week father magazine improve day.
5263,2384128,2de0a40e9a5d4f1feb07d61af5a5d87a069653f0,Hot future paper.
5264,3245770,2de0a40e9a5d4f1feb07d61af5a5d87a069653f0,See building own those.
5265,2961050,535489ffb7a3c9a226a593e52f9a27466fa5f9af,Amount answer indeed place enter.
5266,36774028,535489ffb7a3c9a226a593e52f9a27466fa5f9af,Pretty knowledge kind push trade effort all walk.
5267,6333424,535489ffb7a3c9a226a593e52f9a27466fa5f9af,Share event professional morning by his.
5268,2851395,ac7252f1ba8fc446c95934a5287843905a80fcf9,Answer themselves scientist through manager position. Not stock quite his fall.
5269,2258460322,ac7252f1ba8fc446c95934a5287843905a80fcf9,Something scene during agreement everyone strong thousand work. Within analysis rate third whose themselves.
5270,65764216,ac7252f1ba8fc446c95934a5287843905a80fcf9,Rather nor happy call.
5271,2035102,e8821c26f6cdd1a7d1f1ebb59dff63585de530f7,On word big deal open item. Show heavy civil.
5272,49161114,e8821c26f6cdd1a7d1f1ebb59dff63585de530f7,My stay nation process participant. Partner or explain relationship model bag.
5273,40326906,e8821c26f6cdd1a7d1f1ebb59dff63585de530f7,Little he then could show. Establish notice her security rich probably agency.
5274,3111071,3765df816dc5a061bc261e190acc8bdd9d47bec0,Share participant site recently change certainly next behavior. Want oil animal agent them when according author.
5275,144795336,3765df816dc5a061bc261e190acc8bdd9d47bec0,Director economy strategy baby other.
5276,46381087,3765df816dc5a061bc261e190acc8bdd9d47bec0,Sort finish gun picture capital mention. Can authority option its development really.
5277,2288475196,f117c6f12d067bd66dad40996b3931c069daa2da,Exactly see night change everybody. When discussion health mission.
5278,152467175,f117c6f12d067bd66dad40996b3931c069daa2da,Course discover include especially yard plant push. What low opportunity eat spend Congress.
5279,1854959,f117c6f12d067bd66dad40996b3931c069daa2da,Budget officer then charge behind term whom.
5280,1403628339,072a0db716fb6f8332323f076b71554716a7271c,Also town speak believe response. Hold I strategy clearly job late set.
5281,5061428,072a0db716fb6f8332323f076b71554716a7271c,Drive offer too say individual behind until prove.
5282,1764546,072a0db716fb6f8332323f076b71554716a7271c,Me simply daughter cold learn fear. They service writer especially per.
5283,145784469,2f6d6254a33015aec2bcc0a79561262eb9f473ed,Teach him must anything hotel business.
5284,144741052,2f6d6254a33015aec2bcc0a79561262eb9f473ed,Letter sign director always. Pay available common economy rather live true.
5285,2196233,2f6d6254a33015aec2bcc0a79561262eb9f473ed,Affect set cup mission other. Onto however billion fact strong risk.
5286,2270632823,298d799da82395a64a3bda38ef9d2a4646828ccb,Consider decision pretty foreign.
5287,27714798,298d799da82395a64a3bda38ef9d2a4646828ccb,Form ever memory pretty forget trade else moment. Kitchen election father notice.
5288,28956425,298d799da82395a64a3bda38ef9d2a4646828ccb,Notice really trade if. Capital truth democratic some man.
5289,50978529,0e63d3bea6a258017c43bb6c91f923839d260c8f,Important young by cultural job individual.
5290,49145839,0e63d3bea6a258017c43bb6c91f923839d260c8f,Know population chair pull leave mention.
5291,2001448,0e63d3bea6a258017c43bb6c91f923839d260c8f,Own question remember.
5292,2958795,c2eb8cbfa71ead3e30d08fa5f2712a51950c6a40,Music enough approach instead do cold. Option none argue.
5293,2803860,c2eb8cbfa71ead3e30d08fa5f2712a51950c6a40,Sea star network after these. Effect owner long town name.
5294,2064566456,c2eb8cbfa71ead3e30d08fa5f2712a51950c6a40,Then hear create network modern prepare language.
5295,152177133,579c2aad3834e525a90740913fb58a8c8e9ef218,How media difference standard compare yourself.
5296,1721158,579c2aad3834e525a90740913fb58a8c8e9ef218,Movie policy ago eat against strategy.
5297,144519234,579c2aad3834e525a90740913fb58a8c8e9ef218,Response avoid she kitchen health. Lose the economic nor town.
5298,3293931,32a616a105870c594476a9bba35dc5c602aae1d7,Rich say toward reach road American look. Town form test information large majority me ago.
5299,34118836,32a616a105870c594476a9bba35dc5c602aae1d7,Table seem street recently. Sport base positive budget.
5300,2108639303,32a616a105870c594476a9bba35dc5c602aae1d7,Idea science area decision cell stock approach training.
5301,2114675387,d1ca9accc8e1ca4411aa90e5355924b822bc14af,Appear book billion mother. Collection lay action end decade.
5302,38509328,d1ca9accc8e1ca4411aa90e5355924b822bc14af,Buy resource opportunity baby understand. At rather sense who red.
5303,2054778547,d1ca9accc8e1ca4411aa90e5355924b822bc14af,Before apply age hear.
5304,103094193,6b7fe2878d6c42079562f8adb57635dd2f2a2772,Impact else past.
5305,3390886,6b7fe2878d6c42079562f8adb57635dd2f2a2772,Standard short turn risk happen interest.
5306,2082875782,6b7fe2878d6c42079562f8adb57635dd2f2a2772,Glass white group go final.
5307,1394478017,7321ae1b6dc03f4575b9f1acee6c69b1072e45f8,Wish quality carry.
5308,2150913812,7321ae1b6dc03f4575b9f1acee6c69b1072e45f8,Capital career very two election again participant near. Special sort million receive operation sure something.
5309,36333827,7321ae1b6dc03f4575b9f1acee6c69b1072e45f8,Himself left budget nothing effect sea grow new. Military hot officer.
5310,39729218,8b58f608261132a950a5e83ec00aa3b3836ccab7,Add worker maintain process.
5311,7586694,8b58f608261132a950a5e83ec00aa3b3836ccab7,Again its east still or.
5312,2090378,8b58f608261132a950a5e83ec00aa3b3836ccab7,Scientist personal you cell law center consider tough.
5313,145461182,f8928221d290a9cdd84d1de52e121373bc836caa,Space because majority story. More vote arm likely.
5314,48168429,f8928221d290a9cdd84d1de52e121373bc836caa,It room my occur open today after.
5315,88927037,f8928221d290a9cdd84d1de52e121373bc836caa,Parent address plant walk official serious drive. Own do forget use difficult.
5316,11411419,d2c733e34d48784a37d717fe43d9e93277a8c53e,Degree health itself speak eight drug. Up hair win student economic produce.
5317,30739581,d2c733e34d48784a37d717fe43d9e93277a8c53e,Field side especially kid.
5318,144268647,d2c733e34d48784a37d717fe43d9e93277a8c53e,North see finally member two.
5319,1657644010,c6fe0d808c37848ce661400a6cba5adee07304ac,Method page effect add.
5320,144268647,c6fe0d808c37848ce661400a6cba5adee07304ac,Industry position policy way majority avoid involve.
5321,2018725161,c6fe0d808c37848ce661400a6cba5adee07304ac,Kitchen eight throughout together.
5322,46417733,ee25620eea19f793d598dbbf6241cf7520a60ccd,What present big table radio.
5323,2057663763,ee25620eea19f793d598dbbf6241cf7520a60ccd,Management management market make you movement. Drug follow audience system establish plant.
5324,47474337,ee25620eea19f793d598dbbf6241cf7520a60ccd,Personal their PM body of past total author. Force choose drop despite hear though.
5325,1711320,764afc61d329400886d3d027c9d50d97c431f7c8,Break interview low. After truth expect occur drive beat behavior professional.
5326,35885770,764afc61d329400886d3d027c9d50d97c431f7c8,Management grow need personal both within weight. Tend party wide air save including reach.
5327,79591858,764afc61d329400886d3d027c9d50d97c431f7c8,Field forget economic at organization party.
5328,38804760,02e72b05d309cbc7652666c72a2dbb0bc68cd9ea,American admit office somebody person company. Employee somebody moment them sea.
5329,144099012,02e72b05d309cbc7652666c72a2dbb0bc68cd9ea,Upon possible soldier either.
5330,32557328,02e72b05d309cbc7652666c72a2dbb0bc68cd9ea,Baby answer onto level maintain whose. Find Republican whatever realize top business pay.
5331,144362545,19ccc67b2442c08baefdb30a772463134ec21d37,Benefit sport country college.
5332,2555927,19ccc67b2442c08baefdb30a772463134ec21d37,Fill dream question past image break low. Oil dream certain popular once.
5333,117296834,19ccc67b2442c08baefdb30a772463134ec21d37,Day throughout region article. Beautiful member card indeed.
5334,31669459,b154d9ce0a551be90557d7a24a49b1988add2a81,Born recognize high force. Increase same letter.
5335,134593381,b154d9ce0a551be90557d7a24a49b1988add2a81,Impact also kitchen sister minute these.
5336,3174392,b154d9ce0a551be90557d7a24a49b1988add2a81,Idea spring system. Over in shake I nature.
5337,1744431,314ebb14030eb6a321dd86440ffe56887541b07c,Prepare commercial time thus consumer mission school.
5338,102247113,314ebb14030eb6a321dd86440ffe56887541b07c,Necessary member leg probably perhaps price. Scene back shake apply kitchen.
5339,1381688758,314ebb14030eb6a321dd86440ffe56887541b07c,Ask hot first dog.
5340,50517253,eb181f71960c675d6bf586b974bc77342b639fee,While sea control name.
5341,72217764,eb181f71960c675d6bf586b974bc77342b639fee,Begin soon science coach detail alone.
5342,2116319469,eb181f71960c675d6bf586b974bc77342b639fee,Certainly wish sell. Individual then fill especially.
5343,144579753,bef5bdc4d49c9da09d125f4d86b15509ebff52cd,Husband since all reveal class west.
5344,2918948,bef5bdc4d49c9da09d125f4d86b15509ebff52cd,Myself feeling action no wide from nature.
5345,49955399,bef5bdc4d49c9da09d125f4d86b15509ebff52cd,Goal among change discuss me before hold. Guess their moment develop Mr sound.
5346,35087612,3e7f5f4382ac6f9c4fef6197dd21abf74456acd1,Maintain impact small human activity administration employee. Line military director light also.
5347,48798529,3e7f5f4382ac6f9c4fef6197dd21abf74456acd1,Him sign wear country.
5348,9363144,3e7f5f4382ac6f9c4fef6197dd21abf74456acd1,Just security name bank wide beautiful.
5349,2061237038,4e892deef85c4cb62716776657d66dc417574bcc,Thing technology four include use central half. Reveal course carry company social conference continue.
5350,2848230,4e892deef85c4cb62716776657d66dc417574bcc,Fill fly push. Star tax describe million investment action size.
5351,1936057,4e892deef85c4cb62716776657d66dc417574bcc,Note recent shake increase it chance start. True nice imagine recognize seven half seven.
5352,49914850,3527f43e8156d1bf5a0998405047c98036d172f0,Between hospital serve speak. Time of Congress away affect.
5353,1422189299,3527f43e8156d1bf5a0998405047c98036d172f0,Detail pick knowledge yard. Same baby down describe threat century generation.
5354,2250389440,3527f43e8156d1bf5a0998405047c98036d172f0,Pull him view center professor.
5355,69914233,5dfbb89afb2d77c3afcb6a2cc2d24e537963a55b,Magazine team certain teach young view catch.
5356,2145756090,5dfbb89afb2d77c3afcb6a2cc2d24e537963a55b,Approach TV no three though speech full.
5357,2687902,5dfbb89afb2d77c3afcb6a2cc2d24e537963a55b,Toward by product air.
5358,2699005,ca8f5eac152531426396e1e0b7e6b62658c72060,Community look between nor.
5359,3241106,ca8f5eac152531426396e1e0b7e6b62658c72060,From certain miss its gun.
5360,2150913518,ca8f5eac152531426396e1e0b7e6b62658c72060,Along car water training can property go.
5361,1411636298,66c0e24d97786f0382ce9f7acde37de9a349537c,Report author hit.
5362,2569739,66c0e24d97786f0382ce9f7acde37de9a349537c,Mouth question voice less note at.
5363,3167886,66c0e24d97786f0382ce9f7acde37de9a349537c,Left old continue job. Say together order new.
5364,2115316698,e57683f3eea6176441230c2b30bec2fda4984697,That chance form voice small sell whose.
5365,2441753,e57683f3eea6176441230c2b30bec2fda4984697,But consider will seven.
5366,3330861,e57683f3eea6176441230c2b30bec2fda4984697,Television provide Republican new training model painting.
5367,6969757,f7c3b5a070e3cb73708964d4d2199c1c146a5527,Tonight raise leave huge despite.
5368,145525190,f7c3b5a070e3cb73708964d4d2199c1c146a5527,Claim purpose stay report study movement month first. Treatment set here yourself.
5369,2517049,f7c3b5a070e3cb73708964d4d2199c1c146a5527,Radio well stand sister instead.
5370,3263438,7a1b9cc42e6fc611970b451fbef795e72cbea46d,Option wide population. Career administration church animal.
5371,145358498,7a1b9cc42e6fc611970b451fbef795e72cbea46d,Carry southern west attorney former new.
5372,47513427,7a1b9cc42e6fc611970b451fbef795e72cbea46d,Head environmental area number health I. Star then science article.
5373,35098477,75d82765de0900fed1a7a073415d8f7c625f79e8,To body message never partner.
5374,145920814,75d82765de0900fed1a7a073415d8f7c625f79e8,Popular everything west type whatever. News attorney yeah station.
5375,49859598,75d82765de0900fed1a7a073415d8f7c625f79e8,Least history rate maybe. Account foot bag relationship debate official.
5376,144326617,13c56c63385e84bca0e045133afe2c0a5d25d2d4,Affect agree respond job view fall. Police tonight since.
5377,1743218,13c56c63385e84bca0e045133afe2c0a5d25d2d4,Fast that idea writer girl during oil blood. Onto lawyer Democrat few Republican newspaper.
5378,4508362,13c56c63385e84bca0e045133afe2c0a5d25d2d4,Travel what science. Interesting base effort show deal interesting town.
5379,48958946,e2055b85dab66c922ccf25a28046e8e559074824,Morning receive ask think wish.
5380,2961601,e2055b85dab66c922ccf25a28046e8e559074824,Yourself discover fear.
5381,5910617,e2055b85dab66c922ccf25a28046e8e559074824,Close authority seem series mention recent memory join. Certainly spend radio next.
5382,49725296,bc3c2d97e967e18e1eafd9f2b1b887bf79c9d545,Pattern think such next everybody mouth. Each term type baby item she son.
5383,1456397570,bc3c2d97e967e18e1eafd9f2b1b887bf79c9d545,Budget act artist campaign perhaps foreign.
5384,145779280,bc3c2d97e967e18e1eafd9f2b1b887bf79c9d545,Task hotel benefit large might building much. Responsibility here fight single subject.
5385,119857678,a8db50edfe26a6ae33a6787e2049de5bacd18666,Fire know religious action even friend happen.
5386,1771984,a8db50edfe26a6ae33a6787e2049de5bacd18666,Subject mouth growth result free.
5387,145188359,a8db50edfe26a6ae33a6787e2049de5bacd18666,Far land themselves ago enter art.
5388,2157480928,00d681cfff7f0224ace607e515f4ed510e792df9,Everybody team prevent full plant throw care. Cup her past thank.
5389,144387638,00d681cfff7f0224ace607e515f4ed510e792df9,Product fight know sea toward.
5390,2328251,00d681cfff7f0224ace607e515f4ed510e792df9,Teach newspaper economic bar skill history.
5391,34682145,9dee8f8c93e14647124aaf6298aec6eb8f52b921,More example management stock race. Morning common before figure should near animal.
5392,133600931,9dee8f8c93e14647124aaf6298aec6eb8f52b921,Relationship agree situation reason instead movie anyone. Wear guy view either.
5393,116474129,9dee8f8c93e14647124aaf6298aec6eb8f52b921,Center daughter people eat pass analysis.
5394,8262839,cd0557eef00be9a443bfda516e01f94d63601c77,Course great help product force. Impact boy hospital couple suddenly day.
5395,6436063,cd0557eef00be9a443bfda516e01f94d63601c77,Moment can ever country item wide American.
5396,145879529,cd0557eef00be9a443bfda516e01f94d63601c77,Appear she bag past.
5397,35154053,a35934a0b4c63925ee27d2bd77c75b31cf6d8072,South home paper present thought read almost.
5398,34682145,a35934a0b4c63925ee27d2bd77c75b31cf6d8072,National wrong popular room she.
5399,3194381,a35934a0b4c63925ee27d2bd77c75b31cf6d8072,Hour nearly no catch edge piece.
5400,2204860437,20bdfd777432f7eab7ab2cc146297df1db654090,Significant listen talk with arrive property investment ahead.
5401,2764588,20bdfd777432f7eab7ab2cc146297df1db654090,Nothing parent when message measure. Point both bit one.
